{
  "artifact_type": "gtm_change_log",
  "schema_version": "1.0.0",
  "run_id": "synthetic-duplicate-001-20261016",
  "client_id": null,
  "source_container_file": "synthetic-duplicate-purchase-tags(1).json",
  "optimized_container_file": "optimized_container.json",
  "changes": [],
  "summary": {
    "change_count": 0,
    "high_risk_change_count": 0,
    "manual_review_required": true
  },
  "human_approval_required": true,
  "publishes_gtm_changes": false
}
